{
  "entityId": "Plano",
  "fields": [
    {
      "fieldId": "id",
      "title": "Identificador",
      "type": "uuid",
      "required": true,
      "description": "Identificador único do plano de academia."
    },
    {
      "fieldId": "modalidade",
      "title": "Modalidade",
      "type": "string",
      "required": true,
      "unique": true,
      "enum": [
        {
          "value": "mensal",
          "title": "Mensal"
        },
        {
          "value": "trimestral",
          "title": "Trimestral"
        },
        {
          "value": "anual",
          "title": "Anual"
        }
      ],
      "description": "Periodicidade comercial do plano de academia."
    },
    {
      "fieldId": "valor",
      "title": "Valor",
      "type": "money",
      "required": true,
      "description": "Valor cobrado pelo plano em cada mensalidade gerada."
    },
    {
      "fieldId": "diaVencimento",
      "title": "Dia de vencimento",
      "type": "integer",
      "required": true,
      "constraints": {
        "min": 1,
        "max": 31
      },
      "description": "Dia do mês em que as mensalidades vinculadas ao plano vencem."
    }
  ],
  "lifecycleStates": [],
  "transitions": []
}
