{
  "entityId": "RecebimentoCompra",
  "fields": [
    {
      "fieldId": "id",
      "title": "Identificador",
      "type": "uuid",
      "required": true,
      "description": "Identificador único do recebimento de compra."
    },
    {
      "fieldId": "numeroRecebimento",
      "title": "Número do recebimento",
      "type": "string",
      "required": true,
      "unique": true,
      "description": "Número sequencial que identifica o recebimento de compra."
    },
    {
      "fieldId": "pedidoCompraId",
      "title": "Pedido de compra",
      "type": "uuid",
      "required": true,
      "description": "Pedido de compra ao qual este recebimento está vinculado."
    },
    {
      "fieldId": "dataRecebimento",
      "title": "Data de recebimento",
      "type": "datetime",
      "required": true,
      "description": "Data e hora em que os produtos foram efetivamente recebidos."
    }
  ],
  "lifecycleStates": [],
  "transitions": []
}
