{
  "entityId": "Pagamento",
  "fields": [
    {
      "fieldId": "id",
      "title": "Identificador",
      "type": "uuid",
      "required": true,
      "description": "Identificador único do registro de pagamento."
    },
    {
      "fieldId": "mensalidadeId",
      "title": "Mensalidade",
      "type": "uuid",
      "required": true,
      "description": "Referência à mensalidade para a qual o pagamento foi registrado."
    },
    {
      "fieldId": "dataPagamento",
      "title": "Data do pagamento",
      "type": "date",
      "required": true,
      "description": "Data em que o pagamento foi realizado."
    },
    {
      "fieldId": "valor",
      "title": "Valor pago",
      "type": "money",
      "required": true,
      "description": "Valor efetivamente pago para a mensalidade."
    },
    {
      "fieldId": "formaPagamento",
      "title": "Forma de pagamento",
      "type": "string",
      "required": true,
      "constraints": {
        "maxLength": 100
      },
      "description": "Forma utilizada para realizar o pagamento."
    }
  ],
  "lifecycleStates": [],
  "transitions": []
}
