{
  "entityId": "Diagnostico",
  "fields": [
    {
      "fieldId": "id",
      "title": "Identificador",
      "type": "uuid",
      "required": true,
      "description": "Identificador único del diagnóstico."
    },
    {
      "fieldId": "descripcion",
      "title": "Descripción del diagnóstico",
      "type": "text",
      "required": true,
      "description": "Descripción técnica del análisis realizado y de la causa del defecto informado."
    }
  ],
  "lifecycleStates": [],
  "transitions": []
}
