{
  "entityId": "MovimentacaoEstoque",
  "fields": [
    {
      "fieldId": "id",
      "title": "Identificador",
      "type": "uuid",
      "required": true,
      "description": "Identificador único da movimentação de estoque."
    },
    {
      "fieldId": "tipoMovimentacao",
      "title": "Tipo de movimentação",
      "type": "string",
      "required": true,
      "enum": [
        {
          "value": "entrada",
          "title": "Entrada"
        },
        {
          "value": "saida",
          "title": "Saída"
        }
      ],
      "description": "Indica se as unidades foram adicionadas ou retiradas do estoque."
    },
    {
      "fieldId": "produtoId",
      "title": "Produto",
      "type": "uuid",
      "required": true,
      "description": "Referência ao produto ao qual a movimentação se aplica."
    },
    {
      "fieldId": "quantidade",
      "title": "Quantidade",
      "type": "integer",
      "required": true,
      "constraints": {
        "min": 1
      },
      "description": "Quantidade de unidades registrada na entrada ou saída."
    },
    {
      "fieldId": "dataMovimentacao",
      "title": "Data da movimentação",
      "type": "datetime",
      "required": true,
      "description": "Data e hora em que a movimentação foi registrada."
    }
  ],
  "lifecycleStates": [],
  "transitions": []
}
