{
  "entityId": "RentalItem",
  "fields": [
    {
      "fieldId": "id",
      "title": "Identificador",
      "type": "uuid",
      "required": true,
      "description": "Identificador único do item de locação."
    },
    {
      "fieldId": "rentalContract",
      "title": "Contrato de locação",
      "type": "uuid",
      "required": true,
      "description": "Contrato de locação ao qual este item pertence."
    },
    {
      "fieldId": "equipment",
      "title": "Equipamento",
      "type": "uuid",
      "required": true,
      "description": "Equipamento específico reservado neste item de locação."
    },
    {
      "fieldId": "dailyRate",
      "title": "Valor da diária contratada",
      "type": "money",
      "required": true,
      "description": "Valor diário do equipamento registrado no momento da inclusão no contrato."
    }
  ],
  "uniqueKeys": [
    [
      "rentalContract",
      "equipment"
    ]
  ],
  "lifecycleStates": [],
  "transitions": []
}
