{
  "entityId": "Reparacion",
  "fields": [
    {
      "fieldId": "id",
      "title": "Identificador",
      "type": "uuid",
      "required": true,
      "description": "Identificador único del registro de reparación."
    },
    {
      "fieldId": "detalleTrabajo",
      "title": "Detalle del trabajo realizado",
      "type": "text",
      "required": true,
      "description": "Describe las tareas técnicas efectuadas durante la reparación del aparato."
    }
  ],
  "lifecycleStates": [],
  "transitions": []
}
